<?xml version="1.0" encoding="UTF-8"?>
<!DOCTYPE setup SYSTEM "../../dtd/setup.dtd">

<setup>
    <menu>
        <parameter type="int" name="fadetime" min="0" max="1000" displaytext="{tr(fadetext)}">0</parameter>
        <parameter type="bool" name="showdevices" displaytext="{tr(showdevices)}">0</parameter>
    </menu>

    <translations>
        <token name="tr(fadetext)">
            <trans lang="en_EN">Fade time in ms</trans>
            <trans lang="de_DE">Einblendzeit in ms</trans>
            <trans lang="fi_FI">Häivytyksen kesto [ms]</trans>
        </token>
        <token name="tr(showdevices)">
            <trans lang="en_EN">Show DVB device info when switching channel</trans>
            <trans lang="de_DE">DVB Karten Info beim Umschalten anzeigen</trans>
            <trans lang="fi_FI">Näytä DVB-tiedot kanavanvaihdossa</trans>
        </token>
    </translations>
</setup>
